{
  "import_id": "0198ab31-6c44-7e8a-b2bb-000000000702",
  "state": "available",
  "terminal": true,
  "asset": {
    "asset_id": "ast_b3_7sc3y5x2mtfhxhmnyf657nx2tjzpvwufpjqzx6gcwxh5koqw2fia",
    "media_type": "image/png",
    "byte_length": 53,
    "orientation": 1,
    "encoded_width": 4,
    "encoded_height": 2,
    "display_width": 4,
    "display_height": 2
  },
  "error": null
}